{
  "$defs": {
    "EnvironmentVerificationSpec": {
      "additionalProperties": false,
      "description": "Committed verification script reference.",
      "properties": {
        "script": {
          "minLength": 1,
          "pattern": "^[A-Za-z0-9][A-Za-z0-9._/-]*$",
          "title": "Script",
          "type": "string"
        }
      },
      "required": [
        "script"
      ],
      "title": "EnvironmentVerificationSpec",
      "type": "object"
    },
    "PlatformSpecification": {
      "additionalProperties": false,
      "description": "Platform evidence for a model environment.",
      "properties": {
        "expected_compatible": {
          "items": {
            "minLength": 1,
            "type": "string"
          },
          "title": "Expected Compatible",
          "type": "array"
        },
        "resolved_on": {
          "items": {
            "minLength": 1,
            "type": "string"
          },
          "title": "Resolved On",
          "type": "array"
        },
        "verified": {
          "items": {
            "minLength": 1,
            "type": "string"
          },
          "title": "Verified",
          "type": "array"
        }
      },
      "required": [
        "resolved_on",
        "expected_compatible",
        "verified"
      ],
      "title": "PlatformSpecification",
      "type": "object"
    },
    "PythonSpecification": {
      "additionalProperties": false,
      "description": "Declared and resolved Python version.",
      "properties": {
        "constraint": {
          "minLength": 1,
          "title": "Constraint",
          "type": "string"
        },
        "resolved_version": {
          "minLength": 1,
          "pattern": "^[0-9]+(\\.[0-9]+){1,2}$",
          "title": "Resolved Version",
          "type": "string"
        }
      },
      "required": [
        "constraint",
        "resolved_version"
      ],
      "title": "PythonSpecification",
      "type": "object"
    }
  },
  "$id": "https://torch-dae.local/schemas/environment.schema.json",
  "$schema": "https://json-schema.org/draft/2020-12/schema",
  "additionalProperties": false,
  "description": "Validate the committed inputs for one isolated model environment.\n\nAttributes\n----------\nenvironment_id\n    Canonical identifier for the environment definition.\nmodel_card_id\n    Optional legacy card identity retained only for backward compatibility. New definitions\n    are authorized by ``environment_id`` and do not require this field.\npython\n    Declared version constraint and the exact resolved Python version.\nplatforms\n    Reported, expected-compatible, and verified platform evidence.\nlockfile\n    Repository-relative path to the complete dependency lock.\nproject_file\n    Repository-relative path to the environment project metadata.\nsources_file\n    Repository-relative path to the canonical source manifest.\nverification\n    Committed verification-script reference.\n\nRaises\n------\npydantic.ValidationError\n    If a path escapes the repository, an identity is malformed, or the resolved Python version\n    violates its declared constraint.\n\nNotes\n-----\nValidation reads no runtime state and does not create the environment.",
  "properties": {
    "dependency_manager": {
      "const": "uv",
      "minLength": 1,
      "title": "Dependency Manager",
      "type": "string"
    },
    "environment_id": {
      "minLength": 1,
      "pattern": "^[a-z0-9]+(?:[._-][a-z0-9]+)*$",
      "title": "Environment Id",
      "type": "string"
    },
    "lockfile": {
      "minLength": 1,
      "pattern": "^[A-Za-z0-9][A-Za-z0-9._/-]*$",
      "title": "Lockfile",
      "type": "string"
    },
    "model_card_id": {
      "anyOf": [
        {
          "minLength": 1,
          "pattern": "^[a-z0-9]+(?:[._-][a-z0-9]+)*$",
          "type": "string"
        },
        {
          "type": "null"
        }
      ],
      "default": null,
      "title": "Model Card Id"
    },
    "platforms": {
      "$ref": "#/$defs/PlatformSpecification"
    },
    "project_file": {
      "minLength": 1,
      "pattern": "^[A-Za-z0-9][A-Za-z0-9._/-]*$",
      "title": "Project File",
      "type": "string"
    },
    "python": {
      "$ref": "#/$defs/PythonSpecification"
    },
    "schema_version": {
      "const": "1.0.0",
      "minLength": 1,
      "title": "Schema Version",
      "type": "string"
    },
    "sources_file": {
      "minLength": 1,
      "pattern": "^[A-Za-z0-9][A-Za-z0-9._/-]*$",
      "title": "Sources File",
      "type": "string"
    },
    "verification": {
      "$ref": "#/$defs/EnvironmentVerificationSpec"
    }
  },
  "required": [
    "schema_version",
    "environment_id",
    "python",
    "platforms",
    "dependency_manager",
    "lockfile",
    "project_file",
    "sources_file",
    "verification"
  ],
  "title": "EnvironmentSpecification",
  "type": "object"
}
