{
  "schema_version": "1.0.0",
  "environment_id": "panns-resnet38-map-0434",
  "model_card_id": "panns-resnet38-map-0434",
  "python": {
    "constraint": "==3.12.13",
    "resolved_version": "3.12.13"
  },
  "platforms": {
    "resolved_on": [
      "macos-26.5.2-arm64"
    ],
    "expected_compatible": [],
    "verified": [
      "macos-26.5.2-arm64-cpu-constructor-trial"
    ]
  },
  "dependency_manager": "uv",
  "lockfile": "environments/panns-resnet38-map-0434/uv.lock",
  "project_file": "environments/panns-resnet38-map-0434/pyproject.toml",
  "sources_file": "environments/panns-resnet38-map-0434/sources.json",
  "verification": {
    "script": "environments/panns-resnet38-map-0434/verify_environment.py"
  }
}
